message,package
I have severe tooth pain and need a root canal,Dental
My gums are bleeding when I brush,Dental
I want dental implants,Dental
One of my teeth is broken,Dental
I have cavities in several teeth,Dental
I need braces for my teeth,Dental
My wisdom tooth hurts,Dental
I have a swollen gum,Dental
Root canal treatment was recommended because my tooth developed irreversible pulpitis and antibiotics alone never relieved the pain,Dental
Severe facial pain started after one of my teeth completely broke leaving the nerve exposed,Dental
Is there an emergency dental clinic available on Sundays?,Dental
Most of my tooth has broken off leaving a sharp piece still inside the gum,Dental
An X-ray showed that my lower left wisdom tooth has developed an abscess,Dental
My gums bleed almost every day and I'm worried it has caused persistent bad breath,Dental
Recently both my upper and lower front teeth have been tingling on and off throughout the day,Dental
Following a tooth infection I'm trying to decide between having a root canal or extracting the tooth,Dental
My gums have been shrinking noticeably and feel under constant pressure,Dental
Extraction of my damaged upper front tooth will probably be necessary within the next few months,Dental
A constant throbbing pain in one of my molars has made it difficult to eat,Dental
Cold drinks cause sharp pain in one of my back teeth,Dental
Chewing on the right side of my mouth has become extremely painful,Dental
Part of my dental filling fell out and the tooth is now very sensitive,Dental
Swelling around one of my gums has gradually become worse over the last few days,Dental
The dentist mentioned that my wisdom tooth is growing at an unusual angle,Dental
Sharp pain occurs whenever I bite down on hard food,Dental
Several of my teeth have become sensitive to both hot and cold beverages,Dental
One of my crowns feels loose and causes discomfort while eating,Dental
Persistent pain around my jaw and teeth has been keeping me awake at night,Dental
A piece of my tooth broke off recently and I think I may need an extraction.,Dental
I had to get an infected molar removed after dealing with pain for some time.,Dental
My dentist removed the root of my tooth after a difficult extraction procedure.,Dental
I visited an emergency dentist and found out that my wisdom tooth needed to be taken out.,Dental
I have pain spreading across one side of my mouth but I cannot identify which tooth is causing it.,Dental
Has anyone combined Invisalign treatment with dental implants successfully?,Dental
I am planning to get dental implants but I am concerned about the treatment process.,Dental
Has anyone had dental implants while taking immune-related medications? I would like to know about their experience.,Dental
My gum around one tooth is still swollen and uncomfortable.,Dental
I noticed swelling in my gums last night and I am worried about an infection.,Dental
Several of my crowns and root canal treated teeth have started having problems again.,Dental
My teeth have been extremely sensitive for almost a year especially with cold drinks.,Dental
I recently needed an urgent root canal because of severe tooth pain.,Dental
Half of my face became swollen and the doctor suspected a dental abscess.,Dental
One of my teeth has been causing problems on and off for several weeks.,Dental
My damaged tooth keeps breaking and I am unsure whether it can be repaired.,Dental
I have a cracked tooth that causes sharp pain whenever I bite something hard.,Dental
My dentist told me that my infected tooth might need a root canal treatment.,Dental
The pain from my wisdom tooth has become unbearable and affects my daily activities.,Dental
I have a missing tooth and I am considering getting an implant to replace it.,Dental
My gums bleed every time I brush my teeth and I am worried about gum disease.,Dental
A cavity in one of my teeth has become painful and sensitive recently.,Dental
I woke up with severe tooth pain and my cheek looks slightly swollen.,Dental
My dentist found an infection under an old crown and suggested further treatment.,Dental
I have been having constant pressure around my teeth and jaw for several days.,Dental
One of my front teeth became loose after an accident and I need dental advice.,Dental
I am thinking about getting braces because my teeth are crowded and difficult to clean.,Dental
My tooth hurts when I chew and the pain goes away slowly after eating.,Dental
I have a painful lump near my gum and I think it might be related to my tooth.,Dental
After a previous root canal. I started feeling pain in the same tooth again.,Dental
My dentist recommended removing a damaged tooth because it cannot be saved.,Dental
I have severe tooth sensitivity and sometimes feel sudden sharp pain without any reason.,Dental
I have blurry vision,Eye
I cannot see clearly at night,Eye
I have cataracts,Eye
My eyes are itchy and red,Eye
I have double vision,Eye
My vision became worse,Eye
I have eye pain,Eye
I need laser eye surgery,Eye
Pain has developed in my right eye over the past few days even though my eye examination earlier this year was normal,Eye
Both of my eyelids become stuck together after sleeping and opening my eyes is very painful,Eye
My symptoms seem similar to dry eye syndrome and the early stages of blepharitis,Eye
Blinking causes a sharp pain in my eye that has continued for the past four days,Eye
My cataract has become much worse and the clinic couldn't measure the lens because it was too cloudy,Eye
A specialist recommended that I consult a surgeon experienced in cataract surgery,Eye
A cataract in my right eye is affecting my vision and I also struggle with an ongoing infection due to my autoimmune condition,Eye
My eyesight keeps switching between my right and left eye making it difficult to focus,Eye
Ever since developing a cataract. my vision has remained blurry and I occasionally see double images,Eye
Recently. I've experienced mild double vision and toric lenses haven't improved it,Eye
Bright lights have become uncomfortable especially while driving at night,Eye
Reading small text causes my eyes to become tired and strained very quickly,Eye
My left eye has been watering constantly for the past week,Eye
Everything looks hazy especially when I wake up in the morning,Eye
Sharp pain appears whenever I move my eyes from side to side,Eye
Colors don't seem as bright as they used to especially in my right eye,Eye
There's a constant feeling that something is stuck inside my eye,Eye
I've started seeing floating spots that move whenever I look around,Eye
Vision in one eye suddenly became blurry after waking up this morning,Eye
Watching television for more than a few minutes causes burning and dryness in both eyes,Eye
My vision becomes blurry especially later in the day.,Eye
I have noticed a gray shadow slowly covering part of my vision in one eye.,Eye
The vision in my left eye has been getting worse over the past few weeks.,Eye
Everything looks slightly blurred through my left eye today.,Eye
After being exposed to bright lights. I started seeing flashing lights and floaters.,Eye
Has anyone with rheumatoid arthritis had successful laser eye surgery?,Eye
My eyes seem to flicker throughout the day and it has become quite annoying.,Eye
An eye infection has spread despite several weeks of antibiotic treatment.,Eye
Since switching my medication I am wondering if I still need regular eye examinations.,Eye
I have experienced major vision loss in one eye after cataract surgery.,Eye
My eyesight did not improve as expected after cataract surgery and I needed additional eye tests.,Eye
I am searching for a retinal specialist because of optic nerve damage and macular edema.,Eye
Lately my eyes have become very dry and uncomfortable throughout the day.,Eye
Ever since my eye operation one eye keeps watering continuously.,Eye
Both of my eyes are extremely red and my eyelids have become swollen and flaky.,Eye
I have been diagnosed with high eye pressure and started using prescription eye drops.,Eye
My eyesight becomes hazy whenever I spend several hours working on the computer.,Eye
Bright sunlight makes my eyes uncomfortable and my vision feels washed out.,Eye
I sometimes see tiny floating spots drifting across my vision.,Eye
One of my eyes has become much weaker than the other over the last few months.,Eye
My contact lenses have become uncomfortable because my eyes feel dry all the time.,Eye
Reading small text has become much harder even while wearing my glasses.,Eye
I experience sharp pain behind my eye whenever I move it.,Eye
My eye remains irritated and watery even after finishing my treatment.,Eye
I frequently wake up with swollen eyelids and blurry vision.,Eye
The glare from headlights at night has become much worse recently.,Eye
Colors do not appear as bright as they used to in my affected eye.,Eye
My doctor mentioned that I may eventually need cataract surgery.,Eye
I often feel pressure inside my eyes along with mild headaches.,Eye
The vision in my right eye suddenly became cloudy for no obvious reason.,Eye
I have difficulty focusing because my eyesight keeps changing throughout the day.,Eye
My ophthalmologist recommended further testing after noticing changes in my retina.,Eye
I have chest pain,Cardiac
My heartbeat is irregular,Cardiac
I get shortness of breath,Cardiac
I need a heart checkup,Cardiac
I have high blood pressure,Cardiac
I had a mild heart attack,Cardiac
I feel pain near my heart,Cardiac
I need bypass surgery,Cardiac
Chest pain has been coming and going for nearly two weeks
About six weeks ago doctors diagnosed me with blood clots in both lungs along with a pulmonary infarction,Cardiac
The pain originally spread across my upper back and chest but now it is mostly in my chest and gets worse with movement or lying down,Cardiac
While walking to school my heart suddenly began racing and felt like it was fluttering,Cardiac
My resting heart rate usually stays between 65 and 80 beats per minute although I still notice occasional palpitations,Cardiac
A recent checkup showed that my blood pressure is high and it has been making me feel anxious,Cardiac
For almost a year my blood pressure readings have remained consistently above the normal range,Cardiac
Since developing high blood pressure I've been experiencing frequent episodes of dizziness and vertigo,Cardiac
My pulse is usually around 46 beats per minute and I'm concerned about undergoing anesthesia with such a slow heart rate,Cardiac
Pressing on my chest causes discomfort and my upper back often feels stiff at the same time,Cardiac
Walking up a flight of stairs leaves me unusually short of breath and causes tightness in my chest,Cardiac
My heartbeat occasionally skips a beat before returning to its normal rhythm.,Cardiac
Physical activity causes pressure in the center of my chest that improves after resting,Cardiac
Even mild exercise makes my heart pound much faster than it used to,Cardiac
I've been waking up at night because of chest discomfort and an irregular heartbeat,Cardiac
A squeezing sensation develops in my chest whenever I'm under emotional stress,Cardiac
My blood pressure has been difficult to control despite taking medication regularly,Cardiac
There is a heavy feeling in my chest that sometimes spreads toward my left shoulder,Cardiac
Simple activities such as climbing stairs leave me exhausted and slightly breathless,Cardiac
I've recently noticed swelling around my ankles together with occasional shortness of breath,Cardiac
My doctors ruled out serious heart problems after several tests and believe my chest pain is caused by inflammation.,Cardiac
I keep experiencing ongoing chest pain that sometimes feels sharp and sometimes like pressure.,Cardiac
I have pain across the upper part of my chest that comes and goes during the day.,Cardiac
Over the past few months I have developed chest tightness along with shortness of breath.,Cardiac
I often wake up during the night with aching ribs and discomfort around my chest.,Cardiac
My blood pressure readings have become unusual especially the lower number and I'm concerned.,Cardiac
Ever since recovering from COVID my blood pressure has remained much higher than normal.,Cardiac
Since my heart procedure my pulse has stayed fast even while resting.,Cardiac
I woke up this morning feeling like my heartbeat was irregular and skipping beats.,Cardiac
I previously survived a heart attack and recently experienced another episode of chest pain.,Cardiac
Has anyone recovered well after undergoing triple bypass surgery?,Cardiac
A family member is currently hospitalized because doctors suspect another heart attack.,Cardiac
I have been admitted to the hospital several times because of recurring chest pain.,Cardiac
My specialist believes my breathing problems are related to weakness in my chest muscles.,Cardiac
I often experience heart palpitations together with shortness of breath.,Cardiac
My heart suddenly started beating extremely fast and I could even feel it in my neck.,Cardiac
Even walking short distances leaves me feeling breathless and tight in the chest.,Cardiac
My heartbeat becomes very fast after climbing a few stairs.,Cardiac
I sometimes feel a squeezing sensation in the middle of my chest while resting.,Cardiac
My doctor recommended more heart tests because of my irregular heartbeat.,Cardiac
I feel dizzy whenever my heart starts racing unexpectedly.,Cardiac
I recently noticed my blood pressure is much higher than it used to be.,Cardiac
My chest feels heavy whenever I try to exercise.,Cardiac
I occasionally experience fluttering sensations in my chest that last for several minutes.,Cardiac
My pulse has been unusually slow and it makes me feel tired and lightheaded.,Cardiac
I have episodes where my heart suddenly skips a beat before returning to normal.,Cardiac
Pain in my chest sometimes spreads into my left shoulder and arm.,Cardiac
I become short of breath even while doing simple household activities.,Cardiac
The discomfort in my chest gets worse whenever I lie flat in bed.,Cardiac
I often feel pressure in my chest together with an irregular heartbeat.,Cardiac
My cardiologist advised me to monitor my blood pressure every day because it keeps changing.,Cardiac
I have been feeling frequent palpitations over the past few weeks and they seem to be getting worse.,Cardiac
My knee hurts after an accident,Orthopedic
I broke my arm,Orthopedic
I have shoulder pain,Orthopedic
I need a hip replacement,Orthopedic
My back hurts all the time,Orthopedic
I have a fractured ankle,Orthopedic
My wrist is broken,Orthopedic
I have joint pain,Orthopedic
I woke up last night with severe pain along the side of my knee,Orthopedic
Whenever I kneel down even on a soft surface. it feels like I'm pressing on something sharp,Orthopedic
A cold aching pain has developed in the middle of my back slightly to the left of my spine,Orthopedic
Bending forward causes intense tightness and stiffness across my lower back,Orthopedic
For nearly ten months. I've been dealing with persistent pain around my right shoulder especially near the shoulder blade and trapezius muscle,Orthopedic
My left shoulder has remained painful for years after several minor dislocations,Orthopedic
I'm interested in hearing about other people's experiences with SuperPath hip replacement surgery,Orthopedic
Multiple injections have provided little relief and my hip dysplasia continues to cause significant pain and mobility issues,Orthopedic
Severe pain in my leg and knee has made walking increasingly difficult,Orthopedic
My left knee suddenly gave way. making it impossible to bend without intense pain and even standing up from a chair became extremely painful,Orthopedic
Pain spreads through my lower back whenever I stand for long periods,Orthopedic
My right ankle becomes swollen and painful after only a short walk,Orthopedic
Lifting heavy objects causes a sharp pain across my lower spine,Orthopedic
Both of my knees feel stiff when I get out of bed in the morning,Orthopedic
There's a clicking sensation in my shoulder every time I raise my arm above my head,Orthopedic
Walking up stairs has become painful because of discomfort in my hips,Orthopedic
A dull ache in my wrist gets worse after typing for several hours,Orthopedic
Turning my neck to either side causes pain and stiffness,Orthopedic
My elbow has been sore for weeks especially when lifting or carrying objects,Orthopedic
Pain in my lower back sometimes travels down into my left leg while walking,Orthopedic
I have severe pain running from the top of my leg to the side of my hip and it hurts even more than my knee.,Orthopedic
Pain has gradually developed in my outer thigh and becomes much worse when climbing stairs or walking uphill.,Orthopedic
I noticed a painful lump on my inner thigh that feels tender whenever I touch it.,Orthopedic
My ribs have become extremely sore and painful to touch over the last few days.,Orthopedic
I fractured my arm and also injured my wrist making it difficult to use my hand.,Orthopedic
I have calcium deposits in my shoulder along with rotator cuff damage and the pain is unbearable.,Orthopedic
Pain starts in my neck and shoulder and travels down into my upper arm.,Orthopedic
My shoulder neck and wrist pain have become so severe that I avoid going out.,Orthopedic
I developed long-term pain after an ankle fracture that was not treated properly.,Orthopedic
My back pain suddenly became much worse and now both of my knees hurt so badly that walking is difficult.,Orthopedic
I have been dealing with intense shoulder pain for several days without any improvement.,Orthopedic
Pain spreads from my shoulder down my arm and I can barely move it now.,Orthopedic
I recently developed new shoulder and arm pain that feels different from my previous joint problems.,Orthopedic
I experience sudden spasms in my lower back that are so painful they take my breath away.,Orthopedic
I keep waking up with pain affecting my arm hip and lower back on one side of my body.,Orthopedic
My joints have hurt for years but lately my back pain has become much more severe.,Orthopedic
My hip hurts every time I stand up after sitting for a long period.,Orthopedic
I hear a clicking sound in my knee whenever I bend it.,Orthopedic
My lower back becomes stiff every morning and takes a while to loosen up.,Orthopedic
Walking for more than a few minutes causes pain in my hips and legs.,Orthopedic
I twisted my ankle weeks ago but it is still swollen and painful.,Orthopedic
My shoulder feels weak and painful whenever I try to lift something heavy.,Orthopedic
Pain in my wrist has made it difficult to write or hold small objects.,Orthopedic
Both of my knees ache after standing for long periods.,Orthopedic
I injured my back while lifting a heavy box and the pain has not improved.,Orthopedic
My elbow has become stiff and painful whenever I straighten my arm.,Orthopedic
The pain in my hip spreads down into my thigh while walking.,Orthopedic
My fingers feel stiff and painful especially first thing in the morning.,Orthopedic
I have difficulty climbing stairs because of constant knee pain.,Orthopedic
After a fall. my shoulder has never regained its normal range of motion.,Orthopedic
I feel a sharp pain in my lower back whenever I bend forward.,Orthopedic
My joints become swollen and painful after even light physical activity.,Orthopedic
I want a nose reshaping surgery,Cosmetic
I want rhinoplasty,Cosmetic
I need a facelift,Cosmetic
I want liposuction,Cosmetic
I need a hair transplant,Cosmetic
I want eyelid surgery,Cosmetic
I want cosmetic breast surgery,Cosmetic
I want skin rejuvenation,Cosmetic
Four years after my rhinoplasty I still experience an uncomfortable sensation around the tip of my nose where additional material was placed,Cosmetic
Following rhinoplasty the cartilage on the right side of my nose seems to have separated causing pain headaches and noticeable changes in its shape,Cosmetic
My nose has partially collapsed. my sinuses are filled with cysts and a hole in my soft palate has made speaking and eating extremely difficult,Cosmetic
Hair at the back of my head has gradually become thinner over the past few years and the hair loss continues to progress,Cosmetic
Despite visiting several hair restoration specialists. I haven't found a treatment that successfully regrows my hair,Cosmetic
I've never been satisfied with the appearance of my face because it seems heavy and lacks definition even when I'm in good physical shape,Cosmetic
The lower part of my face appears to sag slightly although my skin doesn't seem loose,Cosmetic
I'm interested in having both a breast lift and a tummy tuck to improve my body contour,Cosmetic
After struggling with obesity for many years I've decided to undergo gastric bypass surgery,Cosmetic
I'm considering cosmetic eyelid surgery because my naturally hooded eyelids affect my appearance,Cosmetic
I'm unhappy with the shape of my nose and would like to know whether revision rhinoplasty is an option,Cosmetic
The scars from my previous cosmetic surgery remain very noticeable and I'm looking for ways to improve their appearance,Cosmetic
Hair thinning has become more obvious around my temples during the past year,Cosmetic
Loose skin after significant weight loss has made me consider body contouring surgery,Cosmetic
I'm interested in liposuction to remove stubborn fat that hasn't responded to diet or exercise,Cosmetic
The appearance of my jawline has changed over time and I'm thinking about cosmetic treatment to improve its definition,Cosmetic
One of my eyelids droops slightly more than the other making my face look uneven,Cosmetic
I'm exploring facial rejuvenation procedures to reduce deep wrinkles and improve skin firmness,Cosmetic
My previous nose surgery left me with breathing difficulties as well as cosmetic concerns,Cosmetic
I'm considering cosmetic surgery to improve the appearance of my abdomen after losing a large amount of weight,Cosmetic
I recently underwent major surgery on my nose because of cancer and it has greatly affected my appearance and confidence.,Cosmetic
A previous rhinoplasty left my nose uneven and I am unhappy with the results.,Cosmetic
I have a noticeable raised scar on my face and neck that I would like to improve.,Cosmetic
I have been looking into liposuction but the treatment seems far too expensive.,Cosmetic
I am considering liposuction on one of my legs after discussing it with a specialist.,Cosmetic
I am searching for hospitals that offer liposuction procedures for lymphedema treatment.,Cosmetic
My hair has become much thinner over the past few months and continues to fall out.,Cosmetic
I am interested in facial rejuvenation treatments to achieve a younger appearance.,Cosmetic
I had gastric bypass surgery and have been dealing with persistent restless leg symptoms.,Cosmetic
I am thinking about bariatric surgery because I have struggled with my weight for years.,Cosmetic
I have gained weight recently and my face and abdomen look swollen.,Cosmetic
I need breast surgery and feel anxious about the procedure and recovery.,Cosmetic
My doctor suggested orbital decompression along with eyelid surgery to improve my condition.,Cosmetic
I would like to remove a noticeable red mark above my upper lip.,Cosmetic
My skin and hair have become much weaker and I am exploring cosmetic treatments to improve them.,Cosmetic
The changes in my face make it look unusually round and it has affected my self-esteem.,Cosmetic
I am thinking about rhinoplasty because I have never been happy with the shape of my nose.,Cosmetic
I would like to restore volume in my face after significant weight loss.,Cosmetic
Loose skin after losing weight has made me consider cosmetic surgery.,Cosmetic
I am interested in a facelift because my skin has become noticeably saggy.,Cosmetic
The scars from an old injury make me feel uncomfortable in public.,Cosmetic
I would like to improve the appearance of my eyelids because they make me look constantly tired.,Cosmetic
I am considering a hair transplant after years of gradual hair loss.,Cosmetic
My cheeks have lost volume and I want to know what cosmetic options are available.,Cosmetic
I have stretch marks that I would like to reduce with cosmetic treatment.,Cosmetic
I have been thinking about skin resurfacing to improve acne scars on my face.,Cosmetic
The shape of my ears has always bothered me and I am considering cosmetic correction.,Cosmetic
I want to reduce the appearance of deep wrinkles around my eyes and forehead.,Cosmetic
After pregnancy. I am interested in procedures to tighten the skin around my abdomen.,Cosmetic
I have excess skin on my upper eyelids that affects both my appearance and vision.,Cosmetic
I would like to reshape my chin to achieve better facial balance.,Cosmetic
I am looking into cosmetic procedures to improve the appearance of my neck and jawline.,Cosmetic
We have been trying to have a baby,Fertility
I need IVF treatment,Fertility
I cannot get pregnant,Fertility
I need fertility consultation,Fertility
We are facing infertility issues,Fertility
I want fertility treatment,Fertility
I have repeated IVF failure,Fertility
I want egg donation information,Fertility
I've undergone surgery twice to remove uterine fibroids and another operation has recently been recommended. I haven't had children yet,Fertility
After experiencing two miscarriages I had surgery in hopes of preventing future pregnancy loss,Fertility
My husband and I have always wanted to start a family but I was recently diagnosed with uterine cancer,Fertility
I had an abortion during the early stages of pregnancy and have concerns about future fertility,Fertility
After struggling with infertility for four years. my doctor recommended IVF and I'm unsure whether it's the right decision,Fertility
I'm wondering if it's possible to have a successful pregnancy or undergo IVF while living with cerebral palsy,Fertility
I'll be turning 41 next month and I'm worried that I may have waited too long to try for a baby,Fertility
