message,package
I'm looking for advice on how to choose a suitable egg donor,Fertility
We've been trying to conceive for more than seven months but my menstrual cycles are very irregular and I frequently notice brown spotting,Fertility
I've been admitted to the hospital several times had a laparoscopy to examine my uterus and received treatment for ovarian problems,Fertility
My doctor suspects that blocked fallopian tubes may be affecting my chances of becoming pregnant,Fertility
Despite regular ovulation tracking. we've been unable to conceive after many months of trying,Fertility
Recent fertility tests showed that my ovarian reserve is lower than expected for my age,Fertility
My periods have become increasingly irregular and I'm concerned that it may be affecting my fertility,Fertility
We're considering IVF after several unsuccessful fertility treatments,Fertility
Hormone test results came back abnormal and my doctor wants to investigate the cause of my infertility,Fertility
I've experienced repeated implantation failure after multiple IVF attempts,Fertility
The fertility specialist recommended freezing my eggs before starting cancer treatment,Fertility
Pain during ovulation has become much more noticeable over the past few months,Fertility
An ultrasound revealed several ovarian cysts that may be interfering with my ability to conceive,Fertility
My partner and I are looking for fertility support as we begin our treatment journey.,Fertility
My doctor explained that I may face complications during pregnancy because of my condition.,Fertility
I have already gone through three unsuccessful IVF cycles despite having good-quality embryos.,Fertility
After four failed frozen embryo transfers I am feeling unsure about what to do next.,Fertility
Has anyone had experience with egg donation treatment at a fertility clinic?,Fertility
I recently turned 40 and am considering using donor eggs to increase my chances of pregnancy.,Fertility
I was recently diagnosed with a rare type of uterine cancer and I'm worried about my fertility.,Fertility
I am looking for a specialist who has experience with egg freezing for women with low ovarian reserve.,Fertility
My partner and I have spent years trying different fertility treatments including donor embryo transfers.,Fertility
I am thinking about freezing my eggs and would like to know what the process and costs are like.,Fertility
We have been trying to conceive for over two years but my menstrual cycles are very irregular.,Fertility
I have a unicornuate uterus and irregular periods and I'm worried about my chances of getting pregnant.,Fertility
I have completed several ovulation induction treatments without achieving a successful pregnancy.,Fertility
I am unsure whether I should try another embryo transfer or investigate the cause of my miscarriages first.,Fertility
Can anyone recommend a fertility immunology specialist or testing center?,Fertility
After having both blocked fallopian tubes removed I became pregnant during my next IVF cycle.,Fertility
We have been trying for a baby for several years without any success.,Fertility
My fertility specialist recommended IVF after other treatments failed.,Fertility
I recently learned that my ovarian reserve is much lower than expected.,Fertility
I would like to know whether egg freezing is still effective at my age.,Fertility
I have experienced multiple early miscarriages and would like to understand the reason.,Fertility
My doctor suggested fertility hormone testing before starting treatment.,Fertility
I have been diagnosed with endometriosis and it is affecting my fertility.,Fertility
We are considering IVF because natural conception has not been successful.,Fertility
I would like more information about embryo freezing and future pregnancy options.,Fertility
My fertility treatment has been emotionally exhausting after several unsuccessful attempts.,Fertility
I have been advised to consider donor eggs because of my age.,Fertility
My partner and I are preparing for our first IVF cycle and would appreciate some advice.,Fertility
I have polycystic ovary syndrome and it has made getting pregnant very difficult.,Fertility
My doctor recommended genetic testing before another embryo transfer.,Fertility
After years of infertility treatment I am considering seeking a second opinion.,Fertility
I recently had fertility preservation discussed before starting cancer treatment.,Fertility
I have frequent headaches,Neurology
I have migraines,Neurology
My hands are shaking,Neurology
I had a seizure,Neurology
I feel numbness in my legs,Neurology
I have memory problems,Neurology
I often feel dizzy,Neurology
I need neurological evaluation,Neurology
My husband has been dealing with severe cluster headaches for nearly nine months,Neurology
About a year ago I started taking cimetidine after experiencing symptoms that seemed similar to irritable bowel syndrome,Neurology
Persistent headaches occur almost every morning and afternoon and sometimes they become much more intense for several hours,Neurology
For several years. I've experienced visual migraines every couple of weeks usually triggered by moving between dark and bright environments,Neurology
I've been living with chronic migraines for years and still haven't found a preventive treatment that works well,Neurology
Along with constant fatigue and pain I've recently developed serious memory problems and often forget simple things,Neurology
At 48 years old. I've become increasingly forgetful and frequently feel mentally foggy throughout the day,Neurology
During conversations I often lose my train of thought and struggle to concentrate,Neurology
Episodes of dizziness usually begin with neck pain followed by a heavy foggy feeling in my head rather than a spinning sensation,Neurology
Despite having an MRI and several balance tests performed by an ENT specialist. no clear cause for my dizziness has been found,Neurology
Frequent numbness and tingling in my hands have started to interfere with everyday activities,Neurology
My headaches become much worse whenever I'm exposed to bright lights or loud noises,Neurology
I've experienced several brief episodes where my speech became slightly slurred before returning to normal,Neurology
A burning sensation occasionally spreads from my neck to the back of my head,Neurology
Concentrating at work has become difficult because I constantly feel mentally exhausted,Neurology
Sudden weakness in one arm lasted for a few minutes before gradually improving,Neurology
I've started forgetting recent conversations even though I remember older events clearly,Neurology
Sharp electric shock-like pain occasionally shoots across one side of my face,Neurology
Simple tasks take much longer than they used to because I lose focus so easily,Neurology
My balance has become noticeably worse and I sometimes feel unsteady while walking,Neurology
